{
  "version": "2.0.0-alpha.2",
  "versionCode": 2000002,
  "packageName": "com.nekonf.nekostatus",
  "sha256": "aaaaaaaaaaaaaaaaaaaaaaaaaaaaaaaaaaaaaaaaaaaaaaaaaaaaaaaaaaaaaaaa",
  "apkAsset": "neko-status-2.0.0-alpha.2-universal.apk",
  "certificateSha256": "bbbbbbbbbbbbbbbbbbbbbbbbbbbbbbbbbbbbbbbbbbbbbbbbbbbbbbbbbbbbbbbb"
}
